{"$schema":"https://json-schema.org/draft/2020-12/schema","type":"object","additionalProperties":false,"required":["schema","section_id","run_id","artifacts","next_section_inputs","state_snapshot"],"properties":{"schema":{"const":"section-bundle/v1"},"section_id":{"enum":["S0","S1","S2"]},"run_id":{"type":"string","minLength":1},"artifacts":{"type":"array","minItems":4,"items":{"$ref":"#/$defs/ref"}},"next_section_inputs":{"type":"array","minItems":1,"items":{"$ref":"#/$defs/ref"}},"state_snapshot":{"type":"object","additionalProperties":false,"required":["accepted","invalidated","unresolved","budget","next_section_inputs"],"properties":{"accepted":{"type":"array","items":{"$ref":"#/$defs/member"}},"invalidated":{"type":"array","items":{"$ref":"#/$defs/member"}},"unresolved":{"type":"array","items":{"$ref":"#/$defs/member"}},"budget":{"type":"object","additionalProperties":false,"required":["review_ref","max_fixes","consumed"],"properties":{"review_ref":{"$ref":"#/$defs/ref"},"max_fixes":{"type":"integer","minimum":1},"consumed":{"type":"array","items":{"$ref":"#/$defs/attempt"}}}},"next_section_inputs":{"type":"array","items":{"$ref":"#/$defs/member"}}}}},"$defs":{"ref":{"type":"object","additionalProperties":false,"required":["path","digest"],"properties":{"path":{"type":"string","minLength":1},"digest":{"type":"string","pattern":"^sha256:[0-9a-f]{64}$"}}},"member":{"type":"object","additionalProperties":false,"required":["identity","ref"],"properties":{"identity":{"type":"string","minLength":1},"ref":{"$ref":"#/$defs/ref"}}},"attempt":{"type":"object","additionalProperties":false,"required":["finding_id","attempt"],"properties":{"finding_id":{"type":"string","minLength":1},"attempt":{"type":"integer","minimum":1,"maximum":5}}}}}
