{"artifacts":[{"digest":"sha256:9e66e307f2632239598556c504abf56695b4a9518b87c087470f111dbc209820","path":"agent-workflows/evidence/sections/S1/review.json"},{"digest":"sha256:e402a9390ccb4e0e785300b40f6c6da7e0105c6edd5963b5924e3df1c636e30b","path":"agent-workflows/evidence/sections/S1/validation.json"},{"digest":"sha256:343b1076fe93160d7772c5a86ed1dbdd2e452f11ad7bb529bb652c1adc9fec38","path":"agent-workflows/evidence/sections/S1/accepted.json"},{"digest":"sha256:de1eb690e02f3e697d759894d6ecdf6c2dfbfc1312386cd82d652657718038a1","path":"agent-workflows/evidence/sections/S1/artifact-S1-A.json"},{"digest":"sha256:2ad53becfaa8dd4b84b9e79e78292a3e5cf3dc0f166a7f283d473a28fd14e8a0","path":"agent-workflows/evidence/sections/S1/artifact-S1-B.json"},{"digest":"sha256:08ea5ebb8cd70a2671895bd5f77148247907b66119af9ada2ad027fab8ec0f4b","path":"agent-workflows/evidence/sections/S1/artifact-S1-C.json"},{"digest":"sha256:330467fa7c297f71ce3dc0a2ff847bb8eb7d53b8d10fe68562e0e046e8c57f9e","path":"agent-workflows/evidence/sections/S1/artifact-S1-D.json"},{"digest":"sha256:cbd4b6e87e7dbdb3956f4f150eb3a94edf7393a8913a8c4934a9d18cc4cc2eed","path":"agent-workflows/evidence/sections/S1/result-S1-A.json"},{"digest":"sha256:39aa4f3560696c8bacfea669bd445d6b9c1394963dc67ba2a875a7ec0f6aecff","path":"agent-workflows/evidence/sections/S1/result-S1-B.json"},{"digest":"sha256:0f6bf8f56ad9455bd7de8e582239ae3ca1f6e1abc3b6fc03df2b9432fefcf4ee","path":"agent-workflows/evidence/sections/S1/result-S1-C.json"},{"digest":"sha256:6c5c1d6254393ca4be8990dc854acf0edb14d886ed8b6fafc19f679d98eef6f1","path":"agent-workflows/evidence/sections/S1/result-S1-D.json"}],"next_section_inputs":[{"digest":"sha256:4846db980aa630bb45461c00f6d6f611038bd9e91a07d6d8d6b075aea6142a45","path":"agent-workflows/evidence/sections/S1/next-S2.json"}],"run_id":"s1-source-close-2026-09-05","schema":"section-bundle/v1","section_id":"S1","state_snapshot":{"accepted":[],"budget":{"consumed":[],"max_fixes":5,"review_ref":{"digest":"sha256:9e66e307f2632239598556c504abf56695b4a9518b87c087470f111dbc209820","path":"agent-workflows/evidence/sections/S1/review.json"}},"invalidated":[],"next_section_inputs":[{"identity":"next-S2","ref":{"digest":"sha256:4846db980aa630bb45461c00f6d6f611038bd9e91a07d6d8d6b075aea6142a45","path":"agent-workflows/evidence/sections/S1/next-S2.json"}}],"unresolved":[]}}
