{"artifacts":[{"digest":"sha256:abc37c4e16efd0ee2a296bb4571b6e488e86d3d7ac304f95303779fff6be3ce3","path":"agent-workflows/evidence/sections/S0/review.json"},{"digest":"sha256:f4a268d84ccd2ddae8c886a18f03fb940e4ff62ced6f95a93d9d1169d301799f","path":"agent-workflows/evidence/sections/S0/validation.json"},{"digest":"sha256:d7c2032306d7edcf06a783fc895eddb45e95c47b1c5a570012ec918f74659e64","path":"agent-workflows/evidence/sections/S0/accepted.json"},{"digest":"sha256:879d4fee322a2c46abd1421048af0f3609ae2cfe0faba447688562a2aaaa9421","path":"agent-workflows/evidence/sections/S0/artifact-S0-A.json"},{"digest":"sha256:456238826773ec156043c53abc84f58937ff9dd52a795b89829781550f6c45fe","path":"agent-workflows/evidence/sections/S0/artifact-S0-B.json"},{"digest":"sha256:58e5b6f03b4f816ddd53cdeadff3dd30af815ddea5cd39790db9294aee198ce2","path":"agent-workflows/evidence/sections/S0/artifact-S0-C.json"},{"digest":"sha256:9d79bd5f0f55c59550e5c7413bfc59a6af03767f1d5541a4cdd396e7f8f00d03","path":"agent-workflows/evidence/sections/S0/artifact-S0-D.json"},{"digest":"sha256:35e60c21567d26d22ec87a424a2b9e81803ee3648a4e10429e7daef0497281e0","path":"agent-workflows/evidence/sections/S0/result-S0-A.json"},{"digest":"sha256:77458375520cc13d039da73d9d96793396e809f8e242ccce3d9f87b5ecaab9ba","path":"agent-workflows/evidence/sections/S0/result-S0-B.json"},{"digest":"sha256:b93134efac242540641cb05fa6c6ad51d9889fe73a64fce2a4a9c0004e7381b6","path":"agent-workflows/evidence/sections/S0/result-S0-C.json"},{"digest":"sha256:ad621f52929684afeeee018d2f205e8bad6f83276b99d3b057708a1d7261da6b","path":"agent-workflows/evidence/sections/S0/result-S0-D.json"},{"digest":"sha256:77c34e72064728be254f2332a1148af9e66dd567bfa573e865f931aed45ab2b5","path":"agent-workflows/evidence/sections/S0/plan.json"},{"digest":"sha256:8a79bd5c9388ab2dab753925b456e6b21748873c7722f0514c0edfb6717e2cd0","path":"agent-workflows/evidence/sections/S0/catalog.json"},{"digest":"sha256:73af3196dc5486d96311049beac396889f6caa46a046b12ce9057b50f3036797","path":"agent-workflows/evidence/sections/S0/transaction.json"}],"next_section_inputs":[{"digest":"sha256:d93bbb524c8ea56e1d431cb6f9627ae170a2572ca1d3395e6bf33cad59478f97","path":"agent-workflows/evidence/sections/S0/next-S0-A.json"},{"digest":"sha256:96115e6b7c9bff2fdd7e3926664be04b7242df6c24f81eece9ad133c11b033c5","path":"agent-workflows/evidence/sections/S0/next-S0-B.json"},{"digest":"sha256:75f27e6e5180614f5fd4b8e6a285ae937b07ecb1325aba0490b55065372e91ed","path":"agent-workflows/evidence/sections/S0/next-S0-C.json"},{"digest":"sha256:b111d15f50c0c1f6d610864bf45b893deb045553f6f56d620d4b0e69c222cd6a","path":"agent-workflows/evidence/sections/S0/next-S0-D.json"}],"run_id":"s0-source-transition-2026-09-04","schema":"section-bundle/v1","section_id":"S0","state_snapshot":{"accepted":[{"identity":"section-review","ref":{"digest":"sha256:abc37c4e16efd0ee2a296bb4571b6e488e86d3d7ac304f95303779fff6be3ce3","path":"agent-workflows/evidence/sections/S0/review.json"}},{"identity":"finding-validation","ref":{"digest":"sha256:f4a268d84ccd2ddae8c886a18f03fb940e4ff62ced6f95a93d9d1169d301799f","path":"agent-workflows/evidence/sections/S0/validation.json"}},{"identity":"accepted-result","ref":{"digest":"sha256:d7c2032306d7edcf06a783fc895eddb45e95c47b1c5a570012ec918f74659e64","path":"agent-workflows/evidence/sections/S0/accepted.json"}},{"identity":"artifact-S0-A","ref":{"digest":"sha256:879d4fee322a2c46abd1421048af0f3609ae2cfe0faba447688562a2aaaa9421","path":"agent-workflows/evidence/sections/S0/artifact-S0-A.json"}},{"identity":"artifact-S0-B","ref":{"digest":"sha256:456238826773ec156043c53abc84f58937ff9dd52a795b89829781550f6c45fe","path":"agent-workflows/evidence/sections/S0/artifact-S0-B.json"}},{"identity":"artifact-S0-C","ref":{"digest":"sha256:58e5b6f03b4f816ddd53cdeadff3dd30af815ddea5cd39790db9294aee198ce2","path":"agent-workflows/evidence/sections/S0/artifact-S0-C.json"}},{"identity":"artifact-S0-D","ref":{"digest":"sha256:9d79bd5f0f55c59550e5c7413bfc59a6af03767f1d5541a4cdd396e7f8f00d03","path":"agent-workflows/evidence/sections/S0/artifact-S0-D.json"}},{"identity":"result-S0-A","ref":{"digest":"sha256:35e60c21567d26d22ec87a424a2b9e81803ee3648a4e10429e7daef0497281e0","path":"agent-workflows/evidence/sections/S0/result-S0-A.json"}},{"identity":"result-S0-B","ref":{"digest":"sha256:77458375520cc13d039da73d9d96793396e809f8e242ccce3d9f87b5ecaab9ba","path":"agent-workflows/evidence/sections/S0/result-S0-B.json"}},{"identity":"result-S0-C","ref":{"digest":"sha256:b93134efac242540641cb05fa6c6ad51d9889fe73a64fce2a4a9c0004e7381b6","path":"agent-workflows/evidence/sections/S0/result-S0-C.json"}},{"identity":"result-S0-D","ref":{"digest":"sha256:ad621f52929684afeeee018d2f205e8bad6f83276b99d3b057708a1d7261da6b","path":"agent-workflows/evidence/sections/S0/result-S0-D.json"}}],"budget":{"consumed":[{"attempt":1,"finding_id":"S0-W1-F001"},{"attempt":2,"finding_id":"S0-W1-F001"},{"attempt":1,"finding_id":"S0-W1-F002"},{"attempt":2,"finding_id":"S0-W1-F002"},{"attempt":1,"finding_id":"S0-W1-F003"},{"attempt":1,"finding_id":"S0-W1-F004"},{"attempt":2,"finding_id":"S0-W1-F004"},{"attempt":1,"finding_id":"S0-W1-F005"},{"attempt":2,"finding_id":"S0-W1-F005"},{"attempt":1,"finding_id":"S0-W1-F006"},{"attempt":1,"finding_id":"S0-W1-F007"},{"attempt":2,"finding_id":"S0-W1-F007"},{"attempt":1,"finding_id":"S0-W1-F008"},{"attempt":2,"finding_id":"S0-W1-F008"},{"attempt":1,"finding_id":"S0-C-F001"},{"attempt":2,"finding_id":"S0-C-F001"},{"attempt":3,"finding_id":"S0-C-F001"},{"attempt":1,"finding_id":"S0-D-F001"},{"attempt":2,"finding_id":"S0-D-F001"},{"attempt":1,"finding_id":"S0-E-F001"},{"attempt":1,"finding_id":"S0-E-F002"},{"attempt":2,"finding_id":"S0-E-F002"},{"attempt":1,"finding_id":"S0-E-F003"},{"attempt":2,"finding_id":"S0-E-F003"},{"attempt":3,"finding_id":"S0-E-F003"},{"attempt":1,"finding_id":"S0-E-F004"}],"max_fixes":5,"review_ref":{"digest":"sha256:abc37c4e16efd0ee2a296bb4571b6e488e86d3d7ac304f95303779fff6be3ce3","path":"agent-workflows/evidence/sections/S0/review.json"}},"invalidated":[],"next_section_inputs":[{"identity":"next-S0-A","ref":{"digest":"sha256:d93bbb524c8ea56e1d431cb6f9627ae170a2572ca1d3395e6bf33cad59478f97","path":"agent-workflows/evidence/sections/S0/next-S0-A.json"}},{"identity":"next-S0-B","ref":{"digest":"sha256:96115e6b7c9bff2fdd7e3926664be04b7242df6c24f81eece9ad133c11b033c5","path":"agent-workflows/evidence/sections/S0/next-S0-B.json"}},{"identity":"next-S0-C","ref":{"digest":"sha256:75f27e6e5180614f5fd4b8e6a285ae937b07ecb1325aba0490b55065372e91ed","path":"agent-workflows/evidence/sections/S0/next-S0-C.json"}},{"identity":"next-S0-D","ref":{"digest":"sha256:b111d15f50c0c1f6d610864bf45b893deb045553f6f56d620d4b0e69c222cd6a","path":"agent-workflows/evidence/sections/S0/next-S0-D.json"}}],"unresolved":[]}}
